WHITE HANGING HEART T-LIGHT HOLDER,6,01-12-2010 08:26,2.55
WHITE METAL LANTERN,6,01-12-2010 08:26,3.39
CREAM CUPID HEARTS COAT HANGER,8,01-12-2010 08:26,2.75
KNITTED UNION FLAG HOT WATER BOTTLE,6,01-12-2010 08:26,3.39
RED WOOLLY HOTTIE WHITE HEART.,6,01-12-2010 08:26,3.39
SET 7 BABUSHKA NESTING BOXES,2,01-12-2010 08:26,7.65
GLASS STAR FROSTED T-LIGHT HOLDER,6,01-12-2010 08:26,4.25
HAND WARMER UNION JACK,6,01-12-2010 08:28,1.85
HAND WARMER RED POLKA DOT,6,01-12-2010 08:28,1.85
ASSORTED COLOUR BIRD ORNAMENT,32,01-12-2010 08:34,1.69
POPPY'S PLAYHOUSE BEDROOM ,6,01-12-2010 08:34,2.1
POPPY'S PLAYHOUSE KITCHEN,6,01-12-2010 08:34,2.1
FELTCRAFT PRINCESS CHARLOTTE DOLL,8,01-12-2010 08:34,3.75
IVORY KNITTED MUG COSY ,6,01-12-2010 08:34,1.65
BOX OF 6 ASSORTED COLOUR TEASPOONS,6,01-12-2010 08:34,4.25
BOX OF VINTAGE JIGSAW BLOCKS ,3,01-12-2010 08:34,4.95
BOX OF VINTAGE ALPHABET BLOCKS,2,01-12-2010 08:34,9.95
HOME BUILDING BLOCK WORD,3,01-12-2010 08:34,5.95
LOVE BUILDING BLOCK WORD,3,01-12-2010 08:34,5.95
RECIPE BOX WITH METAL HEART,4,01-12-2010 08:34,7.95
DOORMAT NEW ENGLAND,4,01-12-2010 08:34,7.95
JAM MAKING SET WITH JARS,6,01-12-2010 08:34,4.25
RED COAT RACK PARIS FASHION,3,01-12-2010 08:34,4.95
YELLOW COAT RACK PARIS FASHION,3,01-12-2010 08:34,4.95
BLUE COAT RACK PARIS FASHION,3,01-12-2010 08:34,4.95
BATH BUILDING BLOCK WORD,3,01-12-2010 08:35,5.95
ALARM CLOCK BAKELIKE PINK,24,01-12-2010 08:45,3.75
ALARM CLOCK BAKELIKE RED ,24,01-12-2010 08:45,3.75
ALARM CLOCK BAKELIKE GREEN,12,01-12-2010 08:45,3.75
PANDA AND BUNNIES STICKER SHEET,12,01-12-2010 08:45,0.85
STARS GIFT TAPE ,24,01-12-2010 08:45,0.65
INFLATABLE POLITICAL GLOBE ,48,01-12-2010 08:45,0.85
VINTAGE HEADS AND TAILS CARD GAME ,24,01-12-2010 08:45,1.25
SET/2 RED RETROSPOT TEA TOWELS ,18,01-12-2010 08:45,2.95
ROUND SNACK BOXES SET OF4 WOODLAND ,24,01-12-2010 08:45,2.95
SPACEBOY LUNCH BOX ,24,01-12-2010 08:45,1.95
LUNCH BOX I LOVE LONDON,24,01-12-2010 08:45,1.95
CIRCUS PARADE LUNCH BOX ,24,01-12-2010 08:45,1.95
CHARLOTTE BAG DOLLY GIRL DESIGN,20,01-12-2010 08:45,0.85
RED TOADSTOOL LED NIGHT LIGHT,24,01-12-2010 08:45,1.65
 SET 2 TEA TOWELS I LOVE LONDON ,24,01-12-2010 08:45,2.95
VINTAGE SEASIDE JIGSAW PUZZLES,12,01-12-2010 08:45,3.75
MINI JIGSAW CIRCUS PARADE ,24,01-12-2010 08:45,0.42
MINI JIGSAW SPACEBOY,24,01-12-2010 08:45,0.42
MINI PAINT SET VINTAGE ,36,01-12-2010 08:45,0.65
POSTAGE,3,01-12-2010 08:45,18
PAPER CHAIN KIT 50'S CHRISTMAS ,80,01-12-2010 09:00,2.55
HAND WARMER RED POLKA DOT,6,01-12-2010 09:01,1.85
HAND WARMER UNION JACK,6,01-12-2010 09:01,1.85
WHITE HANGING HEART T-LIGHT HOLDER,6,01-12-2010 09:02,2.55
WHITE METAL LANTERN,6,01-12-2010 09:02,3.39
CREAM CUPID HEARTS COAT HANGER,8,01-12-2010 09:02,2.75
EDWARDIAN PARASOL RED,6,01-12-2010 09:02,4.95
RETRO COFFEE MUGS ASSORTED,6,01-12-2010 09:02,1.06
SAVE THE PLANET MUG,6,01-12-2010 09:02,1.06
VINTAGE BILLBOARD DRINK ME MUG,6,01-12-2010 09:02,1.06
VINTAGE BILLBOARD LOVE/HATE MUG,6,01-12-2010 09:02,1.06
WOOD 2 DRAWER CABINET WHITE FINISH,2,01-12-2010 09:02,4.95
WOOD S/3 CABINET ANT WHITE FINISH,4,01-12-2010 09:02,6.95
WOODEN PICTURE FRAME WHITE FINISH,6,01-12-2010 09:02,2.1
WOODEN FRAME ANTIQUE WHITE ,6,01-12-2010 09:02,2.55
KNITTED UNION FLAG HOT WATER BOTTLE,6,01-12-2010 09:02,3.39
RED WOOLLY HOTTIE WHITE HEART.,6,01-12-2010 09:02,3.39
SET 7 BABUSHKA NESTING BOXES,2,01-12-2010 09:02,7.65
GLASS STAR FROSTED T-LIGHT HOLDER,6,01-12-2010 09:02,4.25
VICTORIAN SEWING BOX LARGE,32,01-12-2010 09:09,10.95
WHITE HANGING HEART T-LIGHT HOLDER,6,01-12-2010 09:32,2.55
WHITE METAL LANTERN,6,01-12-2010 09:32,3.39
CREAM CUPID HEARTS COAT HANGER,8,01-12-2010 09:32,2.75
EDWARDIAN PARASOL RED,6,01-12-2010 09:32,4.95
RETRO COFFEE MUGS ASSORTED,6,01-12-2010 09:32,1.06
SAVE THE PLANET MUG,6,01-12-2010 09:32,1.06
VINTAGE BILLBOARD DRINK ME MUG,6,01-12-2010 09:32,1.06
VINTAGE BILLBOARD LOVE/HATE MUG,6,01-12-2010 09:32,1.06
WOOD 2 DRAWER CABINET WHITE FINISH,2,01-12-2010 09:32,4.95
WOOD S/3 CABINET ANT WHITE FINISH,4,01-12-2010 09:32,6.95
WOODEN PICTURE FRAME WHITE FINISH,6,01-12-2010 09:32,2.1
WOODEN FRAME ANTIQUE WHITE ,6,01-12-2010 09:32,2.55
KNITTED UNION FLAG HOT WATER BOTTLE,6,01-12-2010 09:32,3.39
RED WOOLLY HOTTIE WHITE HEART.,6,01-12-2010 09:32,3.39
SET 7 BABUSHKA NESTING BOXES,2,01-12-2010 09:32,7.65
GLASS STAR FROSTED T-LIGHT HOLDER,6,01-12-2010 09:32,4.25
HOT WATER BOTTLE TEA AND SYMPATHY,48,01-12-2010 09:32,3.45
RED HANGING HEART T-LIGHT HOLDER,64,01-12-2010 09:32,2.55
HAND WARMER RED POLKA DOT,6,01-12-2010 09:34,1.85
HAND WARMER UNION JACK,6,01-12-2010 09:34,1.85
JUMBO BAG PINK POLKADOT,10,01-12-2010 09:37,1.95
JUMBO  BAG BAROQUE BLACK WHITE,10,01-12-2010 09:37,1.95
JUMBO BAG CHARLIE AND LOLA TOYS,10,01-12-2010 09:37,2.95
STRAWBERRY CHARLOTTE BAG,10,01-12-2010 09:37,0.85
RED 3 PIECE RETROSPOT CUTLERY SET,12,01-12-2010 09:37,3.75
BLUE 3 PIECE POLKADOT CUTLERY SET,6,01-12-2010 09:37,3.75
SET/6 RED SPOTTY PAPER PLATES,12,01-12-2010 09:37,0.85
LUNCH BAG RED RETROSPOT,10,01-12-2010 09:37,1.65
STRAWBERRY LUNCH BOX WITH CUTLERY,6,01-12-2010 09:37,2.55
LUNCH BOX WITH CUTLERY RETROSPOT ,6,01-12-2010 09:37,2.55
PACK OF 72 RETROSPOT CAKE CASES,120,01-12-2010 09:37,0.42
PACK OF 60 DINOSAUR CAKE CASES,24,01-12-2010 09:37,0.55
PACK OF 60 PINK PAISLEY CAKE CASES,24,01-12-2010 09:37,0.55
60 TEATIME FAIRY CAKE CASES,24,01-12-2010 09:37,0.55
